{"candidate_manifest_sha256":"af0ff3cbc9bbea4de6e18c50440cf635a8137efdd74c48b8ce14735abea1fcb9","counts":{"nonblank_cells":6,"rows":2,"sheets":1},"schema_version":"dcs-extraction-receipt/1.0","source_sha256":"83aca7916497d1bdf53e365ba3a5196c56a485cb843373444645d6cefeec68a9","source_tables_sha256":"f2f002af8be8f08e867fdec7b914c5b19a78a17be6fde6ffdfc130823bf28e19","status":"PASS","violations":[]}
