{"candidate_manifest_sha256":"94466c0f1efed64b6e0c5e8ea8e6b3ed5a4537c4a5e44576a2d081b9f409f501","counts":{"nonblank_cells":83,"rows":4,"sheets":1},"schema_version":"dcs-extraction-receipt/1.0","source_sha256":"88c6fb33dd764e2dcede851fe0da825624bc11a4dce77249281d46dd04f61180","source_tables_sha256":"5f091c8ca63839100a95cbcd9aac6733c8b48287d3ec503ec17aa79953934dd1","status":"PASS","violations":[]}
