{"candidate_manifest_sha256":"cd6a449f96b00554a936dfa0b223dc22cef490febf152747644d13d55dd1cd4f","counts":{"nonblank_cells":6,"rows":2,"sheets":1},"schema_version":"dcs-extraction-receipt/1.0","source_sha256":"5e9527a5eca4e642be50b0c26054ef0cb429aae366c62a51c87afbb3265e221f","source_tables_sha256":"e7bd6381dbee30b1ce59c4101e289fb3f32216ee773d27d2f99c2735e1939931","status":"PASS","violations":[]}
