{"candidate_manifest_sha256":"475544e8e657ba9f4a9a85e2c9a19d27c3e172cc42f5a3e8807c83b6f5aeae5b","counts":{"nonblank_cells":6,"rows":2,"sheets":1},"schema_version":"dcs-extraction-receipt/1.0","source_sha256":"9b7607fac3af10acc71e3dda9ce3f547845d4169687975a9e5dfcd2ef6a76437","source_tables_sha256":"d74f0694ce7996b43611fa9ad8cd99992e5594c122cac09c23b6d2707d287d4b","status":"PASS","violations":[]}
